{"bars":[{"ask_ticks":6341267,"bid_ticks":6341247,"close_ticks":6341257,"high_ticks":6360000,"low_ticks":6300000,"n_trades":41337,"open_interest_milli":92000000000,"open_ticks":6330000,"t_ms":1772431200000,"volume_milli":184250000,"vwap_ticks":6335628},{"ask_ticks":6352020,"bid_ticks":6352000,"close_ticks":6352010,"high_ticks":6358000,"low_ticks":6330000,"n_trades":41338,"open_interest_milli":92000000000,"open_ticks":6341257,"t_ms":1772434800000,"volume_milli":185250000,"vwap_ticks":6346633},{"ask_ticks":6338810,"bid_ticks":6338790,"close_ticks":6338800,"high_ticks":6355500,"low_ticks":6310000,"n_trades":41339,"open_interest_milli":92000000000,"open_ticks":6352010,"t_ms":1772438400000,"volume_milli":186250000,"vwap_ticks":6345405}],"borrow_schedule_id":null,"carry_schedule_id":null,"cash_events":[{"cash_event_id":"ce-5ed189151e4dab40","detail":{"mark_ticks":6352010,"rate_ppm":100},"kind":"funding","market_id":"binance-BTCUSDT.PERP","origin":"data","schema_version":"cash_event.v1","source_url":"https://fapi.binance.com/fapi/v1/fundingRate?symbol=BTCUSDT","t_ms":1772438400000}],"category":"crypto","currency":"usdt","delisted_at_ms":null,"description":"BTCUSDT USDT-margined linear perpetual on Binance Futures; funding every eight hours.","fee_schedule_id":"binance-perp-2026-09","first_price_ticks":6330000,"id":"binance-BTCUSDT.PERP","interval_min":60,"kind":"perp","listed_at_ms":1772431200000,"notes":"Contract fixture: three hourly bars and one funding event (CONTRACTS_V2 17.1, 17.3).","point_value_micro":1000000,"provider":"binance","quality":{"life_days":0,"n_trades":124014,"tape_kind":"prints","traded_bars":3,"volume_milli_total":555750000},"roll_source":null,"schema_version":"instrument.v1","session_calendar_id":"continuous","short_allowed":true,"source":"imported","symbol":"BTCUSDT","tags":["btc","linear","perp"],"tick_size_micro":10000,"trades":[{"price_ticks":6331000,"side":"buy","size_milli":250,"t_ms":1772431212000},{"price_ticks":6331500,"side":"sell","size_milli":1000,"t_ms":1772431212000}],"twins":["bybit-BTCUSDT.PERP"],"underlying_id":"binance-BTCUSDT","url":"https://www.binance.com/en/futures/BTCUSDT","vendor":"binance"}
